{
  "v": 1,
  "id": "dec-20261023T121500-5e6f",
  "mode": "canary",
  "required_mode": "canary",
  "candidates": [
    {"action": "StopManagedWorkload", "provider_id": null, "expected_effect_bytes": [800000000, 1200000000], "cost": 0.6, "risk": 0.3}
  ],
  "chosen": {"action": "StopManagedWorkload", "provider_id": null},
  "no_action_reason": null,
  "refused": [],
  "policy_snapshot": {
    "mode": "canary",
    "allowlist": ["TrimOwnBuffers", "RotateOwnLedger", "EmitAdvisory", "RequestCooperativeRelease", "StopManagedWorkload"],
    "rate_limits": {"provider_min_interval_s": 900, "provider_hourly_cap": 2}
  },
  "created_at": "2026-10-23T12:15:00Z"
}
